5/22/2025 15:52:39,Wetzstein,Gordon,Stanford University,Holographic Near-eye Displays,"Holographic near-eye displays are an emerging platform for virtual and augmented reality systems. Their unique ability to control the phase of a displayed wavefront enables aberrations of downstream optics, such as waveguide combiners, to be corrected by the light engine. This ability opens up a new design space for ultra-compact AR/VR display systems. In this talk, we review recent advances in compact holographic display systems with large etendue, efficient AI-based calibration techniques of these systems, and modern computer-generated holography algorithms that leverage Gaussian splatting for wave optics-based holographic displays.","Gordon Wetzstein is an Associate Professor of Electrical Engineering and, by courtesy, of Computer Science at Stanford University. He is the director of the Stanford Computational Imaging Lab and a faculty director of the Stanford Center for Image Systems Engineering. At the intersection of computer graphics and vision, artificial intelligence, computational optics, and applied vision science, Prof. Wetzstein's research has a wide range of applications in next-generation imaging, wearable computing, and neural rendering systems. Prof. Wetzstein is a Fellow of Optica and the IEEE, and the recipient of several awards, including an IEEE VGTC Virtual Reality Technical Achievement Award, an NSF CAREER Award, an Alfred P. Sloan Fellowship, an ACM SIGGRAPH Significant New Researcher Award, a Presidential Early Career Award for Scientists and Engineers (PECASE), an SPIE Early Career Achievement Award, an Electronic Imaging Scientist of the Year Award, an Alain Fournier Ph.D. Dissertation Award as well as several Best Paper and Demo Awards.","Wednesday, July 23, AM, Wednesday, July 23, PM"
5/25/2025 10:52:40,Heidrich,Wolfgang,KAUST,Learned and Domain Specific Imaging Systems,"Computational imaging systems are based on the joint design of optics and associated image reconstruction algorithms. Of particular interest in recent years has been the development of end-to-end learned “Deep Optics” systems that use differentiable optical simulation in combination with backpropagation to simultaneously learn optical design and deep network post-processing for applications such as hyperspectral imaging, HDR, or extended depth of field. In this talk I will in particular focus on new developments that expand the design space of such systems from simple DOE optics to compound refractive optics and mixtures of different types of optical components. I will also highlight how to design application-specific imaging systems that require very low hardware resources using the power of generative models.","Wolfgang Heidrich is a Professor of Computer Science and Electrical and Computer Engineering in the KAUST Visual Computing Center, for which he also served as director from 2014 to 2021. Prof. Heidrich joined King Abdullah University of Science and Technology (KAUST) in 2014, after 13 years as a faculty member at the University of British Columbia. He received his PhD in from the University of Erlangen in 1999, and then worked as a Research Associate in the Computer Graphics Group of the Max-Planck-Institute for Computer Science in Saarbrucken, Germany, before joining UBC in 2000. Prof. Heidrich’s research interests lie at the intersection of imaging, optics, computer vision, computer graphics, and inverse problems. His more recent interest is in computational imaging, focusing on hardware-software co-design of the next generation of imaging systems, with applications such as High-Dynamic Range imaging, compact computational cameras, hyperspectral cameras, to name just a few. Prof. Heidrich is a Fellow of the National Academy of Inventors, IEEE, Optica, AAIA, and Eurographics, and the recipient of a Humboldt Research Award as well as the ACM SIGGRAPH Computer Graphics Achievement Award.",
5/25/2025 23:48:04,Gkioulekas,Ioannis,Carnegie Mellon University,A ray tracer for physics,"Ray tracing has revolutionized science and engineering, by enabling the simulation of light at unprecedented scale and generality. Yet how we simulate light is in stark contrast with how we simulate other physical phenomena, modeled through general partial differential equations, for which methods such as finite elements have been the gold standard for decades. The reliance of these methods on grid-based discretization fundamentally limits how much we can scale or generalize physics simulation, in turn hindering progress across all areas of science and engineering. I will discuss ongoing work to change this state of affairs, by creating a new methods for simulation of partial differential equations that achieve the same scale and generality as ray tracing. As with ray tracing, the key insight behind these algorithms is to elide discretization through Monte Carlo estimation. Our Monte Carlo simulation methods are embarrassingly parallelizable, scale to massive scene specifications, enable differentiability and volumetrization, and create exciting new opportunities for utilizing simulation in computational imaging.","Ioannis Gkioulekas is an associate professor in the Robotics Institute at Carnegie Mellon University. He works broadly in computer graphics and computer vision, focusing on computational imaging: the joint design of optics, electronics, and computation, to achieve unprecedented imaging capabilities. Technical keywords that often show up in his research include: interferometry, acousto-optics, single-photon imaging, lidar, speckle, physics-based rendering, differentiable rendering, volume rendering, Monte Carlo simulation. For his research he has received the NSF CAREER Award, Sloan Research Fellowship, Bodossaki Distinguished Young Scientist Award, and three best paper awards at CVPR and SIGGRAPH.",
5/26/2025 9:37:21,Sankaranarayanan,Aswin,Carnegie Mellon University,PlatonicVR: Exploiting Human Visual Properties for Ultra-Wide Field of View Displays,"Matching the formidable capabilities of the human visual system remains one of the enduring challenges in display research. A fundamental limitation in current stereoscopic displays is the coupling between eyebox extent and field of view, which arises from the eye's use of rotational motion to explore its visual field. This coupling prevents conventional approaches from achieving the ~200° horizontal field of view of human vision without prohibitive complexity.
In this talk, I will present PlatonicVR, a novel stereoscopic display architecture that exploits specific properties of human visual perception to dramatically simplify ultra-wide field of view display design. By leveraging these perceptual characteristics, our approach decouples the eyebox-field of view relationship and enables practical implementation of displays that approach the human eye's natural viewing capabilities. I will discuss the underlying optical principles, demonstrate the effectiveness of our approach, and explore implications for next-generation VR systems.","Aswin Sankaranarayanan is a professor in the ECE department at CMU, where he leads the Image Science Lab. His research interests are broadly in computational photography, signal processing and computer vision. His doctoral research was in the University of Maryland where his dissertation won the distinguished dissertation award from the ECE department in 2009. Aswin is also the recipient of the NSF CAREER award, and  best paper awards at SIGGRAPH, CVPR and ICCP.
","Wednesday, July 23, AM, Wednesday, July 23, PM"
5/26/2025 19:56:53,Heide,Felix,Princeton University,Cameras As Nanophotonic Optical Computers,"Presentation Abstract: Cameras have become a ubiquitous interface between the real world and computers, with applications across domains in fundamental science, robotics, health, and communication. Although their applications are diverse, today’s cameras acquire information in the same way they did in the 19th century: they focus light from the scene on a sensing plane using a set of refractive lenses that minimize deviations from Gauss’s linear model of optics. In this paradigm, increasingly complex lens and sensor stacks are designed to record an ideal image and perform computation only after the capture. For example, the optical stack in the iPhone 16 contains more than seven elements at 7 mm in length. In this talk, I will discuss computational cameras that learn to manipulate the wavefront of incident light with wavelength-scale structuring, previously impractical to design with existing electromagnetic wave simulation methods. These neural nanophotonic cameras may enable unprecedented capabilities in optical design, imaging, and computer vision. As examples, I will describe an ultra-small camera at a few hundred microns in size that matches the quality achieved with cm-size compound lenses. I will also present ultra-thin nanophotonic cameras that perform 99.9% of neural network compute - typically executed in electronics after the capture - in the optics before sensing, at the speed of light.","Felix Heide is an Assistant Professor at Princeton University, Head of AI at Torc Robotics, and Founder self-driving vehicle startup Algolux (now part of Diamler Trucks and Torc Robotics). He is researching the theory and application of computational imaging and computer vision systems. Exploring imaging, vision, and display systems end-to-end, Felix's work lies at the intersection of optics, machine learning, optimization, computer graphics, and computer vision. He received his Ph.D. from the University of British Columbia. Felix obtained his undergraduate degree from the University of Siegen and was a postdoc at Stanford University. His doctoral dissertation won the Alain Fournier Dissertation Award and the SIGGRAPH outstanding doctoral dissertation award. He won the NSF CAREER Award 2021 and the Sony Young Faculty Award 2021. He was named a Packard Fellow in 2022 and a Sloan Research Fellow in 2023. Felix was named SIGGRAPH New Significant Researcher in 2023. He founded the autonomous driving startup Algolux, building on academic research during his Ph.D. thesis. With over 150 employees and venture capital of more than 30 Million USD, Algolux has shipped computer vision software to more than 1 Million vehicles of European automotive manufacturers. ","Monday, July 21, AM, Wednesday, July 23, AM, Wednesday, July 23, PM"
6/4/2025 11:12:03,Süsstrunk,Sabine,EPFL,Neural Cellular Automata: A New Paradigm for Self-Organizing Textures,"In nature, complex patterns such as animal coats, wood grain, and swirling clouds emerge when many simple elements locally interact. Cellular automata (CAs) capture this principle, and neural cellular automata (NCAs) advance it further by learning the local update rule directly from data while preserving locality and parallelism. With carefully designed architectures, we build NCAs that generate rich, evolving 2D and 3D textures in real time. The models are lightweight and run efficiently even on edge devices, thus enabling real-time interactive user control. Our approach not only simplifies the creation and control of intricate visual effects but also prove how NCAs offer a powerful, fundamentally new tool set for computer graphics and texture synthesis.","Sabine Süsstrunk is Full Professor and Director of the Image and Visual Representation Lab in the School of Computer and Communication Sciences (IC) at the Ecole Polytechnique Fédérale (EPFL), Lausanne, Switzerland. Her main research areas are in computational photography and imaging, color computer vision, and computational image quality and aesthetics. Sabine is a Fellow of ELLIS, IEEE and IS&T, and President of the Swiss Science Council (SSC). She organized ICCP 2024 in Lausanne, Switzerland.","Wednesday, July 23, PM"
6/4/2025 23:45:48,Preza,Chrysanthe,The University of Memphis,Computational imaging enables efficient structured illumination microscopy,"Improving the performance of three-dimensional (3D) fluorescence microscopes is a topic that has received a lot of attention over the years. In this talk, I will discuss techniques that we have been developing to improve 3D-spatial resolution based on “optical-transfer function engineering” using novel structured illumination approaches and computational methods, including efficient image restoration using plug and play methods to integrate physical and learned models.","Dr. Chrysanthe Preza is the Kanuri Professor and Chair of the Department of Electrical and Computer Engineering at the University of Memphis, where she joined in 2006. She received her D.Sc. degree in Electrical Engineering from Washington University in St. Louis in 1998.  She leads the research in the Computational Imaging Research Laboratory. Since 2022, she is the founder and Director of the Vertically Integrated Projects (VIP) Program at The University of Memphis. Her research interests are imaging science, estimation theory, computational optical sensing and imaging applied to multidimensional multimodal light microscopy and hyperspectral imaging, and computational imaging enabled by deep learning. She received a CAREER award by the National Science Foundation in 2009, the Herff Outstanding Faculty Research Award in 2010 and 2015, and she was the recipient of the Ralph Faudree Professorship at the University of Memphis 2015-2018. Since 2018, she has been the recipient of the Ravi and Eleanor Kanuri Professorship. She was named Fellow of the SPIE in 2019 and Fellow of the Optica (OSA) in 2020. She served as Associate Editor for IEEE Transactions on Computational Imaging, as Topical Editor for Optica’s Applied Optics, and as an Executive Editor for Biological Imaging, Cambridge University Press. She currently serves as an Editorial Board Member for Journal of Imaging, Computational Imaging and Computational Photography section.","Wednesday, July 23, PM"
6/6/2025 16:05:17,Ye,Jinwei,George Mason University,Revisit Mirrors for 3D Imaging,"Mirrors are ubiquitous in imaging systems. In this talk, I’ll revisit various mirror configurations for 3D imaging. I’ll showcase a catadioptric lens design for snapshot 3D Gaussian Splatting and demonstrate 3D viewing results on hard-to-reconstruct tiny objects in motion, such as a crawling lady bug.","Jinwei Ye is an associate professor of Computer Science at George Mason University. Before that, she was an assistant professor at Louisiana State University (2017–2021). She received her Ph.D. in Computer Science from the University of Delaware in 2014. Her research interests are at the intersection of computer vision, computational imaging, and computer graphics. Her works are supported by NSF and ARL. She received the NSF CAREER awards in 2023. She served in the senior program committee and organizing committee for major computer vision conferences, including CVPR, ICCV, ECCV, WACV, and ICCP.",
6/7/2025 9:32:06,Patashnik,Or,Tel Aviv University,On Attention Layers for Image Generation and Manipulation,"Attention layers play a critical role in generative models. In this talk, I will show that these layers capture rich semantic information, and particularly semantic correspondences between elements within the image and across different images. Through several works, I will show that the rich representations learned by these layers can be leveraged for image manipulation, consistent image generation, and personalization. Additionally, I will discuss the challenges that arise, especially in scenarios involving complex prompts with multiple subjects. Specific issues, such as semantic leakage during the denoising process, can lead to inaccurate representations, resulting in poor generations. I will present methods that mitigate these issues, allowing the generation of complex images.","Or Patashnik is a Senior Lecturer (Assistant Professor) at the School of Computer Science at Tel Aviv University. Her research lies at the intersection of computer graphics, computer vision, and machine learning, with a particular focus on generative models. She develops methods for image and video generation, semantic editing, and personalization, aiming to make visual content creation more controllable and expressive.
Or completed her PhD at Tel Aviv University under the supervision of Prof. Daniel Cohen-Or. During her graduate studies, she also spent time at Carnegie Mellon University as a visiting scholar, collaborating with Prof. Fernando De la Torre and Prof. Jun-Yan Zhu. Her work has been recognized with several awards, including the Blavatnik Prize for Outstanding PhD Students, the Shashua Family Foundation Scholarship, and the Celia and Marcos Maus Annual Prize.","Monday, July 21, AM, Monday, July 21, PM, Wednesday, July 23, PM"
6/7/2025 19:11:22,Fridovich-Keil,Sara,Georgia Tech,Volume Representations for Inverse Problems,"We introduce a family of models, Geometric Algebra Planes, that is the first class of Implicit Neural Representation (INR) trainable by convex optimization. GA-Planes models generalize many existing representations, and have a natural interpretation as a low-rank plus low-resolution matrix factorization. In 3D, we demonstrate GA-Planes’ competitive performance in terms of expressiveness, model size, and optimizability across three volume fitting tasks including radiance field reconstruction. I will conclude with a benchmarking comparison of many INRs against a simple interpolated grid baseline, that highlights remaining limitations of INRs and open problems in 3D signal representation for inverse problems.","Sara Fridovich-Keil is an Assistant Professor at Georgia Tech in the School of Electrical and Computer Engineering, and program faculty in Machine Learning. Before joining Georgia Tech, she was a postdoc at Stanford and completed her PhD at UC Berkeley. Her research focuses on foundations and applications of machine learning and signal processing in computational imaging.","Monday, July 21, PM"